repo-name,Display Name,Description,Version,Repo URL
Bulk-Order-Editor,Bulk Order Editor,"Bulk Order Editor for WooCommerce allows store managers to quickly modify multiple orders at once, directly from the WordPress admin panel.",1.0.0,https://github.com/Open-WP-Club/Bulk-Order-Editor
Last-User-Orders-by-Roles,Last User Orders By Roles,"This tool is especially useful for store managers who need to keep track of customer engagement and adjust user roles automatically based on purchasing activity.",1.0.0,https://github.com/Open-WP-Club/Last-User-Orders-by-Roles
StageGuard,StageGuard,"A WordPress plugin designed to clearly indicate that a website is running in a staging environment with a few extensions",1.1.1,https://github.com/Open-WP-Club/StageGuard
WC-Pre-order,WC Pre Order,"WooCommerce Pre-Order Plugin - It checks for a specific promo code on certain products and limits if not applied.",1.0.0,https://github.com/Open-WP-Club/WC-Pre-order
better-user-search,Better User Search,"Improves the search for users in the admin significantly: Search for first name, last, email and much more of users instead of only nicename.",1.0.0,https://github.com/Open-WP-Club/better-user-search
rank-math-automation-wp,Rank Math Automation Wp,"Optimize WooCommerce products for SEO using RankMath",N/A,https://github.com/Open-WP-Club/rank-math-automation-wp
wp-internal-linking,Wp Internal Linking,"WordPress plugin to manage and analyze internal linking in your WordPress website.",1.0.0,https://github.com/Open-WP-Club/wp-internal-linking
resume-builder,Resume Builder,"Display your resume on a WordPress page or post - simple way to manage all the needed information",1.0.0,https://github.com/Open-WP-Club/resume-builder
plugin-hub,Plugin Hub,"Plugin Hub is Open WP Club official way of installing/updating plugins from their official repos.",1.1.0,https://github.com/Open-WP-Club/plugin-hub
wp-sanitize,Wp Sanitize,"WordPress developers and site administrators who need to work with real data without compromising sensitive information",1.1.1,https://github.com/Open-WP-Club/wp-sanitize
WooCommerce-Phone-Number-Validator,WooCommerce Phone Number Validator,"WooCommerce Phone Number Validator is a WordPress plugin that enhances the WooCommerce checkout process by validating phone numbers based on country-specific patterns. It allows store owners to ensure that customers enter valid phone numbers for their respective countries.",1.1.1,https://github.com/Open-WP-Club/WooCommerce-Phone-Number-Validator
eu-vat-wp,Eu Vat Wp,"WordPress EU VAT is a plugin that helps online store owners comply with EU VAT regulations. It collects and validates VAT numbers at checkout, removes VAT charges for eligible EU businesses, and handles EU tax requirements for digital goods.",1.0.0,https://github.com/Open-WP-Club/eu-vat-wp
WP-User-Blocking,WP User Blocking,"WordPress plugin that allows administrators to restrict access to their website for specific users based on email addresses or IP addresses. It provides a customizable block message and offers features such as email export/import functionality and debug mode.",1.1.0,https://github.com/Open-WP-Club/WP-User-Blocking
phone-order-woo,Phone Order Woo," phone-based order creation with Gutenberg blocks and WordPress Interactivity API for WooCommerce stores",2.0.0,https://github.com/Open-WP-Club/phone-order-woo
WP-Historical-Preservation-Mode,WP Historical Preservation Mode,"A lightweight WordPress plugin that helps preserve websites by disabling content modification capabilities while maintaining full read access to all areas of the WordPress admin.",1.0.0,https://github.com/Open-WP-Club/WP-Historical-Preservation-Mode
wp-Team-Members-Manager,Wp Team Members Manager,"WordPress plugin to manage and display your team members on your website. This plugin allows you to create and manage team members, organize them by departments, and display them in a responsive grid layout.",3.0.0,https://github.com/Open-WP-Club/wp-Team-Members-Manager
WP-File-Visibility-Manager,WP File Visibility Manager,"WordPress plugin that provides granular control over file access and visibility on your WordPress site. It allows administrators to protect specific file types and manage access through an intuitive admin interface.",1.0.0,https://github.com/Open-WP-Club/WP-File-Visibility-Manager
admin-notice-remover,Admin Notice Remover,"Admin Notice Remover allows you to permanently remove specific admin notices that you don't want to see in your WordPress dashboard. ",N/A,https://github.com/Open-WP-Club/admin-notice-remover
google-scholar-wp,Google Scholar Wp,"A WordPress plugin that allows you to display your Google Scholar profile information on your website using a simple shortcode.",1.4.0,https://github.com/Open-WP-Club/google-scholar-wp
logo-link-wp,Logo Link Wp,"WordPress plugin that enhances your site logo's functionality by adding customizable click behaviors. Left-click directs to your homepage, while right-click leads to your specified assets page.",1.3.0,https://github.com/Open-WP-Club/logo-link-wp
wp-simple-order-history,Wp Simple Order History,"A lightweight WordPress plugin that adds a purchase history tab to WooCommerce My Account page, allowing customers to view their order history and manage product reviews.",1.0.0,https://github.com/Open-WP-Club/wp-simple-order-history
sku-auto-woocommerce,Sku Auto Woocommerce,"A WordPress plugin that automatically generates SKUs for WooCommerce products that don't have them. Features bulk generation and customizable SKU patterns.",2.2.2,https://github.com/Open-WP-Club/sku-auto-woocommerce
User-Self-Delete,User Self Delete,"GDPR-compliant WordPress plugin for user self-deletion with country-based data retention periods for legal and tax compliance.",2.0.0,https://github.com/Open-WP-Club/User-Self-Delete
Gravity-Forms-Shopify-Integration,Gravity Forms Shopify Integration,"A WordPress plugin that automatically sends Gravity Forms submissions to your Shopify customer database with marketing subscription opt-in.",1.0.1,https://github.com/Open-WP-Club/Gravity-Forms-Shopify-Integration
order-payment-limiter-woo,Order Payment Limiter Woo,"Automatically cancels WooCommerce orders after failed payment attempts.",1.0.0,https://github.com/Open-WP-Club/order-payment-limiter-woo
opengraph-svg-generator-wp,Opengraph Svg Generator Wp,"A WordPress plugin that automatically generates beautiful SVG OpenGraph images for social media sharing.",N/A,https://github.com/Open-WP-Club/opengraph-svg-generator-wp
Priority-Processing-WooCommerce,Priority Processing WooCommerce,"A WordPress plugin that adds a priority processing and express shipping option to WooCommerce checkout, allowing customers to pay an additional fee for faster order handling.",1.4.4,https://github.com/Open-WP-Club/Priority-Processing-WooCommerce
inventory-insights-woocommerce,Inventory Insights Woocommerce,"Monitor WooCommerce product stock levels by tags and attributes to help with wholesale ordering decisions.",1.2.5,https://github.com/Open-WP-Club/inventory-insights-woocommerce
spam-user-detective-wp,Spam User Detective Wp,"Spam and bot user detection plugin for WordPress and WooCommerce that helps you identify, manage, and remove suspicious user accounts while protecting legitimate users.",1.5.5,https://github.com/Open-WP-Club/spam-user-detective-wp
smart-product-export-woo,Smart Product Export Woo,"A WordPress plugin that allows you to export WooCommerce product SKUs based on various filter criteria, making inventory management and bulk operations simple and efficient.",1.1.0,https://github.com/Open-WP-Club/smart-product-export-woo
inventory-alerts-woo,Inventory Alerts Woo,"WooCommerce plugin that displays low stock and out of stock alerts directly on the order edit page.",1.1.2,https://github.com/Open-WP-Club/inventory-alerts-woo
disable-gutenberg-for-wp,Disable Gutenberg For Wp,"Enable or disable Gutenberg editor for specific post types in WordPress. Perfect for sites where you want to use Classic Editor for selected content while keeping Gutenberg for others.",N/A,https://github.com/Open-WP-Club/disable-gutenberg-for-wp
plugins-showcase-wp,Plugins Showcase Wp,"No description available",N/A,https://github.com/Open-WP-Club/plugins-showcase-wp
llms-txt-for-wp,Llms Txt For Wp,"Generate llms.txt and Markdown versions of your WordPress content for AI/LLM consumption.",1.1.0,https://github.com/Open-WP-Club/llms-txt-for-wp
order-printing-woocommerce,Order Printing Woocommerce,"Print WooCommerce orders as clean A4 PDF documents directly from the admin panel.",1.2.0,https://github.com/Open-WP-Club/order-printing-woocommerce
